{
  "schema_version": "visualai.image-annotation.snapshot/v1",
  "project_id": "project-detection",
  "snapshot_id": "snapshot-detection-001",
  "snapshot_name": "Detection training snapshot",
  "created_at": "2026-07-29T08:00:00Z",
  "task_type": "detection",
  "annotation_format": "visualai.normalized/v1",
  "asset_root": "assets",
  "classes": [
    {
      "id": "0",
      "label": "person"
    }
  ],
  "samples": [
    {
      "id": "image-det-001",
      "relative_path": "images/street.jpg",
      "width": 640,
      "height": 480,
      "size_bytes": 12345,
      "sha256": "0123456789abcdef0123456789abcdef0123456789abcdef0123456789abcdef",
      "split": "train",
      "revision": "rev-det-001",
      "objects": [
        {
          "type": "bbox",
          "id": "object-det-001",
          "class_id": "0",
          "x": 64.0,
          "y": 96.0,
          "width": 192.0,
          "height": 192.0
        }
      ]
    }
  ]
}
